{
  "title": "Test title",
  "template-html": "Resources/FullGeneration/testTemplate.txt",
  "template-pdf": "Resources/FullGeneration/testTemplate-pdf.txt",
  "output-html": "doc.html",
  "output-pdf":  "doc-pdf-input.html",
  "pages": [
    {
      "path": "Resources/FullGeneration/Page/firstPage.md",
      "title": "First page title"
    },
    {
      "path": "Resources/FullGeneration/Page/secondPage.md",
      "title": "Second page title"
    },
    {
      "path": "Resources/FullGeneration/Page/thirdPage.md",
      "title": "Third page title"
    }
  ]
}